<?xml version="1.0" encoding="UTF-8"?>
<votiCommento xmlns:xsi="http://www.w3.org/2001/XMLSchema-instance" xsi:noNamespaceSchemaLocation="votoCommento.xsd">

<votoCommento><id>1</id><matricolaStudente>3</matricolaStudente><idCommento>1</idCommento><accordo>4</accordo><idAutoreCommento>4</idAutoreCommento><stato>0</stato></votoCommento><votoCommento><id>2</id><matricolaStudente>3</matricolaStudente><idCommento>1</idCommento><accordo>3</accordo><idAutoreCommento>4</idAutoreCommento><stato>0</stato></votoCommento><votoCommento><id>3</id><matricolaStudente>3</matricolaStudente><idCommento>1</idCommento><accordo>4</accordo><idAutoreCommento>4</idAutoreCommento><stato>1</stato></votoCommento><votoCommento><id>4</id><matricolaStudente>5</matricolaStudente><idCommento>1</idCommento><accordo>4</accordo><idAutoreCommento>4</idAutoreCommento><stato>1</stato></votoCommento><votoCommento><id>5</id><matricolaStudente>4</matricolaStudente><idCommento>4</idCommento><accordo>3</accordo><idAutoreCommento>5</idAutoreCommento><stato>1</stato></votoCommento><votoCommento><id>6</id><matricolaStudente>11</matricolaStudente><idCommento>1</idCommento><accordo>4</accordo><idAutoreCommento>4</idAutoreCommento><stato>1</stato></votoCommento><votoCommento><id>7</id><matricolaStudente>11</matricolaStudente><idCommento>8</idCommento><accordo>4</accordo><idAutoreCommento>4</idAutoreCommento><stato>1</stato></votoCommento><votoCommento><id>8</id><matricolaStudente>3</matricolaStudente><idCommento>10</idCommento><accordo>4</accordo><idAutoreCommento>12</idAutoreCommento><stato>1</stato></votoCommento></votiCommento>
